{
  "schemaVersion": 1,
  "subject": {
    "kind": "ravel-package",
    "id": "client_only",
    "version": "0.0.0"
  },
  "implementationMethod": "original",
  "sources": [],
  "rights": [
    {
      "surface": "code",
      "status": "cleared",
      "basis": "Original work written for this repository and licensed under MIT OR Apache-2.0."
    },
    {
      "surface": "models",
      "status": "not-applicable"
    },
    {
      "surface": "names",
      "status": "cleared",
      "basis": "\"Client only\" is an ordinary phrase chosen for this package."
    },
    {
      "surface": "textures",
      "status": "not-applicable"
    },
    {
      "surface": "sounds",
      "status": "not-applicable"
    }
  ],
  "attribution": [],
  "publication": {
    "status": "cleared",
    "reviewedBy": "Ravel",
    "notes": "Contains no third-party code, assets, branding, credentials, or filesystem paths."
  }
}
