{
  "attribution": [
    {
      "name": "BlakeBr0",
      "notice": "The upstream vanilla-plus tweaks collection read for this entry is authored by BlakeBr0 and published under the MIT licence. It was read at the pinned revision below to write a behaviour specification. Ravel's counterpart is an independent implementation and is not affiliated with, endorsed by, or derived from the original's source text.",
      "url": "https://github.com/BlakeBr0/PickleTweaks"
    }
  ],
  "implementationMethod": "source-informed",
  "publication": {
    "notes": "The fetched source lives only in the public repository's ignored fixture tree at tests/fixtures/local/m6-clean-room/ and is not tracked. The specification derived from it is tracked at specifications/m6-foundation/RVL-086.md and is published in-tree in this public repository. The upstream material is not cleared for publication while the names surface is unresolved. The fetched tree includes the entry's binary assets (62 texture files) and about three hundred declarative model, block-state, loot, tag and recipe documents; the textures were not opened and the declarative documents were read only for the census the specification's section 5.7 records.",
    "reviewedAt": "2026-09-05",
    "reviewedBy": "structure-reviewed 2026-09-05 by an independent Claude reader that had seen no upstream source; it read the specification first and then the counterpart's module list and public types to see whether a structural noun had crossed, after the counterpart was implemented; verdict: accepted; the specification's read/inferred/unknown markers and closing coverage statement were checked present. No human has read the specification in full.",
    "status": "private-only"
  },
  "rights": [
    {
      "basis": "MIT, read at the source rather than trusted from the inventory. Reading, modification and derivative works are permitted, which is what source-informed reimplementation requires. The counterpart must not copy source text; the specification written from this read carries no upstream identifier, which checks/verify-spec-identifiers.sh was run over and returned no finding.",
      "status": "cleared",
      "surface": "code"
    },
    {
      "basis": "MIT imposes no behavioural restriction and the inventory records behaviour as cleared and sourceUse as permitted for this entry.",
      "status": "cleared",
      "surface": "behaviour"
    },
    {
      "basis": "Unchanged from the inventory. MIT does not grant trademark rights, so the project's own name, its mod id and its content identifiers remain unresolved. The specification therefore names nothing after the original, and no save-compatible identifier mapping is specified. The constraint bites less here than for a catalogue entry, because this entry's value is its decision rules and arithmetic rather than its content list, but it still means a counterpart cannot be save-compatible with the original.",
      "status": "unresolved",
      "surface": "names"
    },
    {
      "basis": "62 texture files were fetched with the source and were not opened. The inventory records textures as cleared for this artifact and the licence reserves no asset separately. Nothing upstream is tracked or shipped; any counterpart art is rewritten from reference under policies/source-access.json and recorded in the package's assets-provenance.json.",
      "status": "cleared",
      "surface": "textures"
    },
    {
      "basis": "The fetched tree carries no binary model file; its models are declarative model and block-state documents fetched with the source and read only for the registration census the specification records. The inventory records models as cleared for this artifact and the licence reserves no asset separately. Nothing upstream is tracked or shipped.",
      "status": "cleared",
      "surface": "models"
    },
    {
      "basis": "The fetched tree contains no sound file, which is what the inventory's not-applicable verdict for this artifact holds. The specification refers to sounds only as host sound effects reused by the entry's blocks, items and interactions, never as material shipped with it.",
      "status": "not-applicable",
      "surface": "sounds"
    },
    {
      "basis": "No branding material was fetched or read; the display name, logo and author identity are excluded regardless of licence status under policies/source-access.json. The mod descriptor's display name, author, credits, update feed and product page were read only to confirm the dependency and side declarations the specification's section 2 and section 16 state, and none of that text is transcribed. The descriptor declares no logo file.",
      "status": "not-applicable",
      "surface": "branding"
    }
  ],
  "schemaVersion": 1,
  "sources": [
    {
      "accessedAt": "2026-09-05T00:00:00Z",
      "category": "source-code",
      "locator": "https://github.com/BlakeBr0/PickleTweaks",
      "producedBy": "M6-W3 clean-room reader",
      "revision": "git c44b625b4e7df25b730120e70d4b82c72af0c20c, commit message 'Release 9.0.6', dated 2025-12-30; sha256 of the fetched source archive: 8938c979c4fe970f3e8dfc9d06bd688739363c274ac8836717aed2b61d027348",
      "use": "The upstream implementation, fetched as a source archive into the public repository's ignored fixture tree at tests/fixtures/local/m6-clean-room/tar/ and extracted alongside it, and read to write specifications/m6-foundation/RVL-086.md. Version correspondence to the pinned pack artifact -- exact: the build script at this revision declares version '1.21.1-9.0.6' and an archive base name that together produce the pinned artifact file name PickleTweaks-1.21.1-9.0.6.jar, and its properties file declares the game version 1.21.1. The revision was located by reading the build-script history on the branch that holds the 1.21 line: the project publishes no tag and no release, keeps one rolling branch per game-version line, and the commit immediately after this one raises the declared version to the next release on the same branch, so this commit is the only one whose build script declares the pinned version. No decompilation was performed and no jar was opened."
    },
    {
      "accessedAt": "2026-09-05T00:00:00Z",
      "category": "metadata",
      "locator": "LICENSE at the repository root of the source above, in the fetched tree",
      "producedBy": "M6-W3 clean-room reader",
      "revision": "read directly from the fetched tree, not from any index",
      "use": "The licence, verified at the source rather than trusted from M5's triage. It is the MIT licence verbatim, twenty-one lines, carrying 'Copyright (c) 2018 BlakeBr0' and the standard permission grant with no additional term and no separate asset reservation. MIT permits reading, modification and derivative works, so the inventory's permitted verdict for this entry is confirmed rather than assumed. The mod descriptor in the same tree also declares the licence as MIT."
    },
    {
      "accessedAt": "2026-09-05T00:00:00Z",
      "category": "metadata",
      "locator": "inventory/atm10-tts-2.0.2/plans.json and waves/m6-foundation.json",
      "producedBy": "M5 inventory and M6-W1",
      "revision": "as frozen by M5 and consumed by the foundation wave manifest",
      "use": "The claims this record checks: the entry is sourceUse permitted with method source-informed-reimplementation, owner client-presentation, artifact PickleTweaks-1.21.1-9.0.6.jar, one entry dependency RVL-042 and two platform dependencies, and a declared MIT licence. Confirmed above; the single entry dependency and the two platform dependencies are confirmed against the mod descriptor's own three mandatory declarations, all of which declare both sides. The wave manifest admits the entry under cluster closure as a leaf, which is what the specification's section 16 is written against. One inventory-adjacent observation rather than a correction: the descriptor also carries an optional accessory-slot integration with a mod outside this wave, which the plan row does not list because it is not mandatory; the specification's section 15 records it as host-blocked."
    },
    {
      "accessedAt": "2026-09-05T00:00:00Z",
      "category": "metadata",
      "locator": "tests/fixtures/local/m6-clean-room/fetch-manifest.txt in the public repository, ignored tree",
      "producedBy": "M6-W3 clean-room reader",
      "revision": "one line appended in the file's existing four-field form: repository, ref, commit, sha256 of the archive",
      "use": "Records the fetch. No fetch tool exists in either repository; the earlier rows were written by hand and this one was fetched with a plain archive download from the same host and appended in the same form, digesting the archive with sha256 as the existing rows do. The digest binds the archive as fetched at the time above rather than asserting that the host re-serves identical bytes. No pre-existing row for this repository was in the file; this is its first."
    }
  ],
  "subject": {
    "id": "RVL-086",
    "kind": "other",
    "originalAuthor": "BlakeBr0",
    "originalProject": "PickleTweaks",
    "version": "9.0.6"
  }
}
